{
  "appName": "mental-health-app",
  "port": 8000,
  "cwd": "/Users/atflow/repos/mental-health-app",
  "command": "PORT=8000 node server.js",
  "startupWaitSeconds": 20,
  "healthcheckPath": "/",
  "logPath": "/tmp/mental-health-app.log",
  "pidFile": "/tmp/mental-health-app.pid",
  "funnel": {
    "https": false,
    "background": true,
    "anchor": {
      "enabled": true,
      "port": 80,
      "https": true,
      "background": true
    }
  }
}
